Category,Message
0,"Sally/Greg,   I have been offered the opportunity by Giga (our IT research company) to have their head researcher come in to give an informal talk to our ENW leaders on what Giga see as major trends in IT in 2002.
I've accepted this offer and will have him present at our ENW staff meeting on 8th November.
I think it might be quite interesting, hope you do too.
Regards
"
0,"Sally:   I enjoyed the ENW presentation this morning, it looks like a great place to be.
I am on the UT campus recruiting team and I know a strong candidate that I feel would be a very good fit for an IT position in ENW.
He graduated this May and has been trying unsuccessfully for make contact with Enron recruiters for some time.
Could you possibly pass on this resume to an appropriate person in recruiting?
Thanks for the help.
"
0,"We have surpassed the Enron 2001 minimum commitment spend of $8,000,000 with EDS.
We would not have met our commitment without being creative and asking EDS to purchase $5,000,000 worth of flat screens for use in Enron Center South.
In 2002 we once again have an $8,000,000 ""take or pay"" commitment.
Currently, we have approximately $3,000,000 worth of 2002 EDS utilization commitments from various Enron business units.
Which means we will need another $5,000,000 worth of creative EDS spend in 2002.
After 2002 the Enron spend commitment to EDS is $5,000,000 per year with no set contract termination.
My understanding is that the way in which the original financing deal with EDS was booked deters us from ending our relationship with EDS.
Please find the details attached.
"
0,"As you are all aware, the latest Risk Management Policy specifically addresses Operational Risk, and more specifically commits Enron to develop systems and processes that enable Enron to better evaluate its operational risk.
To that end, I have asked Wanda Curry to lead a cross-functional team (the ""Operational Risk Committee""), which will be jointly accountable for meeting this commitment.
I would like to have representatives from Enron Assurance Services, RAC, Research, Information Technology, GRMO and Arthur Anderson.
Enron's primary objective for monitoring its exposure to operational risk is to (a) identify the derivation of operational risk exposures and (b) improve the Company's systems and processes to mitigate such risk.
The guidelines for operational risk assessment are essentially undeveloped.
It will be our challenge to identify, assess, categorize, quantify and mitigate exposure to operational risk.
The risk capital allocation process includes the consideration of operational risk.
Initially, this assessment will be based on a qualitative view of the business unit's internal processes, people and systems.
The initial goal, for completion prior to year-end 2001, is to establish a baseline and/or report card to convey a sense for where we are now.
It is Enron's objective, as reflected in the Risk Management Policy, to increase the sophistication of risk measurement for operational risks through documented qualitative assessments and quantitative measurements.
A list of additional objectives to be addressed by the cross functional team has been prepared by Wanda.
These include: 	 Develop a qualitative operational risk assessment approach and implement.
This approach should enable a quick review of key functions and standards to identify weaknesses, monitor progress over time, and provide management with a representation of operational risk.
Assess and improve integrity of daily risk reports, i.e.
require confirmation that all books are captured, aggregated and processed through RisktRAC, CreditAg, and Infinity applications Ascertain the extent of spreadsheet usage across Enron and develop the ability to monitor NOP, V@R, and MTM for spreadsheets separately, i.e.
a Spreadsheet DPR.
Work with GRMO to develop ""rules of use"" for financial valuation models and spreadsheet ""books"" Utilize the existing RMS database and develop the ability to monitor intercompany - interbook activity (initially for forward positions only) and report variances  Recommend metrics for quantitative measurement of operational risk Access need for additional or improved risk databases  Wanda will be contacting each of you to identify your designated operational risk contact that will participate on this cross-functional team.
Thanks,
"
1,"Sally / Bill / Shawn  This is a quick note to let you know that as of Monday 1 October Enron Europe will be introducing a robust New Account Opening Policy for all trading counterparties.
The Operational Credit team will be responsible for ensuring the smooth roll-out of the policy and for ensuring compliance with it.
The salient points of the policy are that:  traders will be more accountable for relevant Regulatory and internal compliance concerning their counterparties; money laundering checks will be completed for all new counterparties prior to trading; the Compliance Group will give sign off for all new counterparties prior to trading; RAC will give sign off for all new counterparties prior to trading.
These controls are already in place for the majority of Enron Europe's counterparties, however, the introduction of the Policy enables us to demonstrate this more effectively to the Regulators and to monitor compliance more easily.
I attach the policy below.
If you have any questions pls give me a call on +44 7783 5261.
Thanks   -   Sam
"
0,"Sally,  I was part of the employee breakfast this morning and thought it went well.
As an idea, my group (Laura Johnson) publishes the  Enron Net Works News intranet site.
I know you've got an article out there already.
Would you like to use ENN as a forum for answering some of the questions or perhaps making a statement about ""leadership""?
I'll be glad to send Laura your way and hold up the current publication so your message is timely to the troops.
Rich Hall
"
0,"Jeff / Sally,  Shona just informed me that I missed the Steering Comittee meeting yesterday....
I remember getting an e-mail from you (Jeff) announcing that they were going to happen and that we should prepare for them, ....but I don't remember getting an invite for an actual meeting.
I've been on vacation, and when I came back I could have easily deleted the invite by accident, in an attempt to quickly get through my two hundred e-mails, so if I did, I apologise for not attending!
Could you please let me know when the next would be and what the frequency would be going forward?
regards
"
0,"Everyone:  Thanks for the data you have sent.
The initial analysis phase has been completed.
Towards reaching our ultimate objective we request October 2001 (actual) net A/R data rolled up to the corporate parent and November 2001 (estimated) net A/R data rolled up to the corporate parent.
Please send your files to me by noon Thursday, November 1.
On Thursday afternoon, Tim Proffitt and I would like to schedule meetings with someone from each group to review the data and confirm our understanding of the receivables cycle.
If you have any questions, concerns, or suggestions, please call me as soon as possible.
Thank you for your help.
"
0,"Sally,   Attached is the Contact List that was submitted to Tammie Schoppe yesterday at Louise's request.
I am going to add more detail (i.e, title, departments), as well as any changes that yourself and Bob Hall  might suggest.
Thanks so much in helping us clarify what was needed.
"
0,"Please find attached a revised invoice for EES.
Please let me know if you have any adjustments and I will correct prior to this afternoon's meeting.
Thanks,
"
0,"Sally,  I am currently working with Cindy Olson and Kelly Kimberly in the diversity area, of which Ken Lay has asked to put renewed emphasis on.
Mr. Lay participates in the Houston CEO Diversity Roundtable, which consist of 10 of Houston's largest corporations.
On October 16th Cindy, Kelly and I met with Gerald Smith of Smith Graham & Company, Robert Carter of The Enterprise Group and Willie Alexander of W.J.
Alexander & Associates as a follow-up to a recent meeting Mr. Lay and Cindy attended.
These gentlemen represent a coalition of 13 Houston relatively large minority professional services firms who are looking to bring additional value to Enron and expand their footprint in some of the larger Houston area companies.
According to Cindy, the goal is for Enron to be a pilot in utilizing some of these professional services firms.
My plan is to conduct due diligence on these organzations prior to making formal recommendations to the Management Committee.
"
0,"I would like you to both to make a concerted effort to host upcoming Houston GISB meetings and if possible lets see if we can do it in Enron Center South.
That would be great PR and also sends a signal to our partners that nothing here is different.
Let me know if we get one on the calendar, tks - Bob
"
0,"Attached is the format that Tim Proffitt's team would like to see the data presented in.
This is the information previously requested in Chris Heron's email yesterday and setting the Thursday noon deadline.
The file shown below is physical gas; their goal is to show the data at a business unit level by ultimate parent; then by operating company level by ultimate parent; i.e., ENA,EGM,EIM,; and then finally at an Enron corp level by ultimate parent.
If you have questions about file format please call me at extension 37962.
Thanks to all of you for your hard work.
Leslie
"
0,"As you both are aware (not publicly) we are 'right-sizing' again.
This will impact EBS's requirement for services from ENW.
We are finalizing the revised 2002 'look' and it's not pretty.
Confidentially, we will be significantly lower than the 440 we have at present.
As far as I predict right now we'll need the following:  IT Development/Systems  I've met with Inja and asked her to plan for 'minimal maintenance mode' - no development - by 1/1/02.
I've asked her to shoot for no higher than $2m - from $11.2m.
I realize this will involve potential periods of down-time and very thin coverage - unfortunately it's all we can afford.
Inga came back at $1.95m - wihout herself - however, we will need a strong leader - and I've asked her to look at anyway she can stay involved/manage what is going to be a lot of 'no, sorry can't do that' conversations.
This covers upkeep of EnFiber, NETS, EComms, Remedy, PPCS, Fact and all our DB requirements.
IT Infrastructure  I've gave Jenny/Kerry a heads-up of around 300 folks for 2002 a couple of weeks ago - we will be lower.
Our space and IT requirements will be lower accordingly.
We will based out of Houston with a Shepherd warehouse.
No Europe/Asia support can be assumed.
We will also not require EOL.
Let me know what I get for 'not much to spend'.
Energy Ops  Currently at $5m supporting 36 folks.
This will be trimmed to 17 folks.
We will also need a small Contract Admin support level from Pat W's team.
That's a heads-up.
Sorry it's such unpleasent news.
Let me know if I've missed anything.
Barry.
"
0,"Here are the notes from your four employee meetings and from the two Mark Frevert employee meetings.
Call me if you have any questions or comments.
Eric
"
0,"Hi Sally,  I know it's very early to be contacting you, but I hope that you will remember KPMG when you get to UBS and need help with systems integration/data mapping type work.
UBS was one of my clients when I lived in Switzerland and I was very involved with the implementation of a system called DACFA 2 which was used for global data pooling and consolidation.
I have actually re-initiated contact with people I know in UBS Corporate Audit in Zurich and will be providing them with general information concerning wholesale energy trading.
We would very much like to speak to you regarding your planned role in Netco and the direction you think the company will take.
Again, I realize that's it very early, but I know that you will continue to operate at Enron speed and if we wait it will be too late to help.....  Best regards,
"
0,"Ladies,      Do to time restraints in  presenting the prospective Provisionals to the Board prior to their  invitations being issued and the Provisional Orientation, I need to change the  Feb. Board meeting to Feb. 4th.
Lisa will send meeting  reminders when the location is confirmed.
If any of you see any problems  with this please contact me ASAP.
Please confirm you have received  this.
Nancy
"
0,"Here is an updated version of the Energy Ops Overview (Total Budget/Headcount broken out by Business Unit) and the Headcount Report by Business Unit/Function.
We've  verified these numbers with Fin Ops so everything should be in order.
Let me know if you have any questions.
Thanks,
"
0,"Sally-  Just to keep you informed:  OU Telephone Calls: Clay Shamblin - we spoke; he seemed very concerned.
He said that he had heard rumors of a 20% RIF in London Jennifer Reimer - we spoke; she appreciated the call and did not seem worried Dan Hyslop - left message for him Ryan Herron - left message for him  UT Telephone Calls: Rachel Ravanzo - I spoke to her Thursday to extend her offer deadline to 11/15.
I reassured her at the time that the offer was secure Vivek Shah - left message for him Kruti Patel - we spoke; she seemed worried but was comforted by the call and even began asking questions about prospective business units for her first rotation Vinay Adenwala - left message for him Cathy Wang - left message for her     Have a great weekend!
lexi 3-4585
"
0,"Attached for your information is ENW/EBS-IT staff and their skill set inventories along with relative ranking.
Many members are already spoken for by Anthony Dayao and those people are excluded from the list.
Also 16 others will be needed for supporting EBS systems and their information is provided for your future reference.
HR will be working with us to make a smooth transition.
If you should like to get to know them to fill your needs, please work with our HR to set up schedules to get to meet them.
If you need further information, please call me.
Thank you.
Regards,
"
0,"Sally:  Thanks for the call today and I look forward to our meeting to discuss the pending curve validation process enhancements with Andersen.
As requested, attached is the EWS status from Andersen.
Please call Mechelle or me if you have any questions  Shawn
"
0,"Hi Sally,   Attached is the first cut at average deal count and tenure information for EOL and non-EOL trading.
The only missing pieces at this point are European Metals and ""Other"", both of which we should have from London first thing in the morning.
I will send an updated file as soon as we have that information, and we wil be standing by tomorrow in case there are any revisions needed, or additional requests.
Thanks,
"
0,"All -  Ramsey Soliman (PPA major) attended our Fantastic Friday October 25-27.
He received and has accepted a full-time offer with us.
The remaining 14 full-time candidates from UT will attend Fantastic Friday November 15-17.
Please e-mail Dolores Muzzy if you are interested in participating in any of the events during that weekend.
Thanks!
"
0,"Hey Sally-  This note got kicked back to me when I tried to send it to  you yesterday, so hopefully it will make it through this time.
Thank you for your wonderful letter explaining your  decision to stay and display ""visible leadership"" during this very difficult  period.
I read an excerpt of it to the group, and everyone's hearts were with  you.
You were greatly missed, but of course we all understood and supported your  decision.
It was wonderful meeting you and I thank you for your  wonderful contributions to the first session.
I hope once things stabilize a bit  you'll have a chance to re-engage with the group.
"
1,"2002 YEAR-END VACATION CARRYOVER GUIDELINES   I will be sending to you today hard copies of the vacation carry-over report for your business unit.
Please verify the accuracy of the 40 hours carry-over and sign the bottom of the page.
Additionally, if you have employees, who for business reason, need to carry-over more than 40 hours, please do the following:  ?
Place the total number of hours over the 40 hours carry-over in the column entitled ""additional carry-over amount approved""  ?
Initial and provide business rationale.
If there is not enough space on the report, please provide your rationale under separate cover.
Please sign and date at the bottom of each sheet.
Approval for carryover in excess of 40 hours will need the approval of the Creditors Committee and Executive HR.
Please complete and return sheets to me  by January 22, 2002.
The endorsed exceptions will be reviewed by the Bankruptcy Committee and Human Resources leadership from January 25-29, 2002.
We hope to post and reflect all approved carry-over vacation by January 31, 2002.
Please call if you have any questions.
I appreciate your support in this process.
Hector McLoughlin Ext.
36703
"
1,"Hi Sally,  Attached is the approval letter from the National Council BOD for your chapter's logo product sales at the upcoming convention.
Please let me know if you have any questions after reading it.
Also, the 2002 National Convention Committee is contemplating allowing chapter logo product sales on Thursday, April 25, 2002, the day before convention.
A time for the sale hasn't been specified yet, but would probably coincide with convention registration and check-in.
I need to know ASAP if your chapter would be interested in doing this.
Take Care, Kathy Hoyt               National Council Ways & Means VP   - Wildflowers Approval Ltr.doc
"
0,"I had IT run numbers of deals that go out past 2002.
Total = 6632 Buys= 3464 Sells= 3168  It will take some time to get alot beyond that info,  but I think this gives a clear picture that there are a substantial number of deals going out long-term.
Thanks
"
0,"Hi Sally,   At the Net Works All Employee Meeting, you displayed a deep understanding of Enron's business and business issues.
Would you be able to help me gain a similar mastery.
I don't know where to start looking.
Your time and understanding is appreciated.
"
0,"Sally,   here is the list..... sorry it's a little later than the 4pm deadline....
I had to go bully some people to convince them to yield their contractors.
The top section is for those few we should retain, with short explanations in the comment field.
The 2nd section is the main set with end date.
At the bottom is the anticipated monthly burn rate saving.
This list does not contain the EGM/EIM contractors as Jeff Johnson was to send you his seperately.
Please let me know, when you want us to pull the trigger on the contractors....!
regards
"
0,"Sally,  Here is a first cut at our contractor cuts.
I am still working on the rates/monthly savings.
In most cases, I guessed.
I should have updated rates tomorrow.
Please let me know if you have any questions.
JR
"
0,"Hi Sally,   Please send me any documents that were worked on over the weekend.
I have the consolidated IT spreadheet.
I don't have any others.
Thanks
"
0,"As discussed in our meeting on Monday, Net Works will be conducting a year-end talent review to identify the top 15% of its employees.
In order to prepare for this meeting, please refer to the attached guidelines and criteria.
The top 15% should be those individuals who have strong long-term potential and are critical to retain under the current company circumstances.
Your Human Resources representative will be contacting you to offer assistance.
Names of individuals should be submitted to Marla Barnard by 4:30 p.m. today.
This information, along with the next steps for the process will be discussed at our  5 p.m. meeting today.
Thank you for your cooperation.
"
0,"Good morning-  Discussions have taken place between EBS (Barry Pearce) and RAC (David Port) to make adjustments to the EBS daily risk-reporting process.
This memo will outline the changes that have been discussed and agreed upon.
EBS will implement these changes this week.
DPR   All risk books will be run on Tuesday and Thursday of each week and P&L will be reported for those days.
POSITIONS AND CURVES  Pending an IT solution, positions and curves will be loaded each day.
On days when the books are not run, we will use prior day information.
Per discussions with Credit, this process is sufficient for counterparty exposure reporting.
CASH FLOWS  Cash flows will be loaded on days the books are run.
Infinity will pick up prior information on days when books are not run.
"
1,"Sally-  Yesterday at the floor meeting on the 32nd floor, I asked you a pointed question regarding trust of company management.
I appreciated your effort to confront the frustration that many employees currently have.
However, you also requested other questions.
I have a number of questions, and I have tried to collect a number of questions from those that I have heard around the floor.
In addition, I have a couple of suggestions for what could be done to build badly lacking morale.
I am sorry for the long list, but in reality this is probably just the tip of the iceberg regarding questions and concerns out there.
I hope that you can answer some of these questions, and I hope that you can ask some of these questions to those who might know.
I appreciate your efforts.
Here is the list:      I have sent this to my two supervisors as well.
Have a nice day.
Tom Chapman
"
0,"Attached is a list of the key personnel identified within EGM (at all levels) that given an elimination of their position in EGM should be placed in another position somewhere at Enron.
These are all people who would be fungible across the organization and have performed at a high level for a period of time.
Call me if you have any questions.
Brent
"
0,"Mark and Jim, As part of pulling together Data Room for possible EBS sale, we are asked to come up with information regarding in-house developed software and labor cost.
I would like to have your direction on the policy question whether to include Enfiber and Sabor Settlement systems.
Sabor Settlement system is using Unify Settlement as the foundation and Enfiber is patterned after EnPower which potentially could give some valuable competitive insight into our Trading.
Do you think these systems should be included in the EBS sales package?
As shown on the attachment, those systems are included at the present time.
Thank you.
(including PPCS/Dorado)
"
0,"This is way over the top as far as what you and Greg asked for yesterday, but as I was writing, it turned into a Project Everest status update as well.
I hope you find it useful.
Let me know if you have questions...  T
"
0,"Mark,  While Enron's management teams are reviewing actions plans for the upcoming six to nine months, I understand that functional transition teams will be assembled to address the planned merger.
I would like to register my strong interest in assisting any transition team where my skills could add value.
Prior to developing and supporting corporate as well as enterprise systems at Enron my career has spanned across General Electric Capital Services and ABB on a global basis.
Much of this experience has included system integration and change management.
Let me know if you have any questions to the above.
Otherwise, I wanted to let you know of my interest and desire in working towards a successful transition for Enron.
Regards,
"
1,"Attached is a mini dash that summarizes the proposed deal to grant a license for POPS to AEP.
Please review and let me know of any issues, questions or concerns.
Yesterday evening AEP sent some last minute changes to the license agreement primarily dealing with arbitration.
I will be meeting with Barbara Gray and my counterpart from AEP, Dave Banks, tomorrow to nail down this agreement.
I'd like to get signatures on Friday so that we can move forward with getting our first payment and then start the process of delivering the application.
On a related note there have been some issues between AEP and Enron on the commercial side of the business.
Louise Kitchen and Eric Vanderwalde are involved in working through those issues.
Brian Redmond has asked that we call him before executing this agreement.
"
0,"When: Monday, November 19, 2001 10:00 AM-11:00 AM (GMT-06:00) Central Time (US & Canada).
Where: ECN 872  *~*~*~*~*~*~*~*~*~*  Background & Meeting Objective:  Under the direction of Tim Belden, Kevin Presto, Lloyd Will, Anthony Dayao and Beth Perlman, Todd Busby and I have completed the 3 week analysis of wholesale and retail power systems integration.
We would like to present the results of our analysis and discuss recommendations the team believes will lead to cost savings and process efficiencies.
The analysis results are enclosed.
Agenda;  Background Summary of Results Integrated Systems Vision Open Issues Recommendations
"
0,"Attached is an Excel file of the EES IT FTEs.
The first tab lists all employees and is sorted by job title and then by name.
There are two columns.
One is labeled Top 10% and the other Critical.
Asterisks are place in the columns as indicators of employees classified as the top 10% talent and the employees critical to retain.
The second tab is a summary sheet of the top 10% and the employees critical to retain.
Employees are sorted by title and then by name.
Please let me know if you have any questions.
"
