Category,Message
1,"Greg,  Just as a follow up to our conversation, I have serious concerns about the estate's ability to service IT requests.
The number of people that remain in the estate, that understand the gas and power systems, is limited (and we're receiving resignations now).
With this in mind, I would like to have the ability to outsource the IT department (applications, infrastructure) and potentially the back office staff to a consulting company (potentially Accenture or CGEY).
We would need to move the estate employees into this company and incentivize them to stay.
The consulting company could then supplement the staff and the Enron estate employees could now have a career path at the consulting company.
To make this deal attractive, the consulting company would like to have the ability to create a services company and offer IT and fulfillment and processing services to other companies.
By the way, this could be done for other commodities outside gas and power.
The deal would have to include royalty payments to the estate for each additional services agreement.
The intent is to make the services company into a thriving business.
We would also want to sell Commodity Logic (IP included) to round out the services offering.
We could consider selling the IP to our EGM and EIM systems as well.
All in all, the intent is to bring value to the estate and support the estate while the businesses wind down or start up.
We must make sure that the NETCO agreement allows the estate to license the gas and power software in some capacity and continue to develop the applications.
As an aside, the estate cannot perform on the Bridgeline or AEP deals.
There are not enough resources that fully understand the system, therefore, we cannot maintain a fully operational production quality system.
These deals must either be moved to NETCO or we need to find another alternative (the above referenced services company or selling the software to AEP and Bridgeline).
I know this is long winded, but I needed to get these points down on paper.
I am on vacation next week, but can be reached on my cell phone at 713-240-0919 or at my house in Kiawah at 843-768-6651.
I'll also have my Blackberry but reception is poor on the island!
Have a great holiday.
Beth
"
0,"I copied you on what I sent to Corp, but the attached file has more detail you might be interested in.
Let me know if you would like to sit down this morning and go over it.
Kerry
"
0,"Greg (Adams), Attached is our cash forecast.
There are several important points to keep in mind with this forecast: 1.
This is our best guess at this point.
As other business units clarify their business plans, it will affect our activity.
Once their plans are set and communicated to us, we can better forecast our numbers.
2.
This forecast represents the estate only.
(Since that is what we discussed in the meeting on Monday)  We have made no attempt to forecast NETCo since that has already been done and is seperate.
3.Infrastructures numbers are somewhat soft due to the Outlook problems experienced yesterday.
As they firm up or we get additional information, we can update numbers.
4.
We have not included any future severance or retainage payments as we discussed.
5.
I have included a tab which attempts to segregate costs by business unit.
Again, this is soft and will be better defined as the business units define their plans.
6.
I will be out of the office after today for a while.
If you have questions after today, contact Mike Galvan (x3-5439) or Kevin May (x5-2508) 7.
I have not put this file on the O: drive since it is being emailed.
Let me know if I need to.
Kerry (x5-4895)
"
1,"Following up on today's meetings, it is critical that we have your revised 19-month Cash Budget as early in the day on Tuesday, December 18th as possible.
(This format file has been revised to correct some formulas on the first page.)
Revised/Detailed 19 Month Cash Budget - Due December 18th ASAP As with the version you submitted earlier this week, revenues, expenses and other items need to be presented on a ""cash basis"".
WE NEED A SUBMISSION FOR EACH BUSINESS UNIT EVEN IF THERE IS NO PLANNED CASH MOVEMENT WITH CORP. With the exception of payroll, benefits and related items, there should be no allocations in your expense figures.
Networks is working on an overall budget for the organization, and Corporate will budget for rent and insurance expenses (allocations back to the business units will be done at a later date).
If you have not done so already, please confirm with Corporate HR your current payroll and headcount levels and make any adjustments from that level going forward.
For those business units that have some entities in bankruptcy as of 12/12/01, we will need one file that consolidates all those entities in bankruptcy, and one file that consolidates those that are not.
If as part of the initial submission you had broken out your business units into different segments, please do so for this plan as well.
Where it is requested or noted (*) please provide detailed back-up information on the appropriate sheets.
Please do not add any rows or columns to the first sheet labeled ""format"" or ""O&M_Detail"".
We are hopeful that most of the additional information requested is readily available.
If you have any questions please call myself (3-3887) or Mike Deville (5-7852)
"
0,"Sally, here is the latest org.
chart for the NETCO Logistics team.
If the promotion recommendations I made are followed through then a few title changes will be necessary.
Let me know if you have any questions, tks - Bob
"
0,"Please see the attached file for your respective area (by your last name) and make sure you're comfortable with your latest forecast numbers (excluding salaries).
I have added a Capex section for any groups that will plan on spending capital dollars.
Please be as detailed as possible.
Assume forecast dollars are only reflective of the estate.
For those ENW groups likely to have resources moving to NETCo, please include those forecast dollars in the ""NETCo"" tab.
E.g., If we need a total picture of Jenny's spend, we'll add the ""Rub"" tab (estate) with the ""NETCo"" tab Jenny submits.
Jenny/Beth P., A license / maintenance renewal schedule was obtained from GSS.
We put together a summary tab called ""Lic-Main Breakout"".
These dollars are reflected in your respective forecasts.
Please review for completeness and ensure we are not double counting any dollars already included by your folks.
Please confirm your respective numbers and reflect any changes you know of by end of day today.
Thanks,
"
1,"Andrew, etal    I wanted to provide an update on what people should expect on monday in respect to payment proposals.
We initiated test files on Thursday & Friday, to validate the distribution list and allow the BU Approvers & Delegates to get a feel for the data  We experienced some email address issues that have been corrected.
There are some additional names that were provided late Friday that will be added on Monday.
If your name was added by Andrew on Friday, you will not receive the files until Tuesday.
Expect data by Company type.
Non-dip companies - Reports will include all unpaid open items that have not been blocked for payment.
You should be marking the items that you DO NOT WANT to pay in the file & forwarding it to George Wasaff.
We will only release the items authorized by the BU & the cash committee.
Dip Companies - We will not be running a proposal for the DIP companies on Monday.
We are still working with the BU's to ensure that they have properly blocked the pre-petition open items posted to the commodity vendors before sending the proposals for approval.
We expect to finalize this on Monday so we can start the process on Tuesday.
It is imperative that this activity be completed before initiating this daily process.
When we run these on Tuesday, I would not really expect that many items.
We have not begun to process the post-petiton non-trade invoices.
We have been working to establish a process for segregating these invoices as well and have blocked posting of December activity until everyone was ready.
We expect to open up December on Monday.
I feel very confident that we will be ready to initiate this process for the Dip Companies on Tuesday.
If you have any questions or concerns, please give me a call at 5-5301 or drop me email.
Thanks
"
1,"Attached is a revised Credit Watch listing as of 4/23/01.
Please note that NUI Utilities, Inc. has been placed on ""No Trades"".
If there are any personnel in your group that were not included in this distribution, please insure that they receive a copy of this report.
To add additional people to this distribution, or if this report has been sent to you in error, please contact Veronica Espinoza at x6-6002.
For other questions, please contact Bill Bradford at x3-3831, Russell Diamond at x5-7095, or Brant Reves at x3-9897.
"
0,"Attached is an updated transitions list.
Please review and send any changes so I can update.
I will update again Thursday and will include a column for status.
We are in the process of drafting procedures which will have to become a formal protocol for AEP.
These are:  Request for New/maintenance of counterparties.
Once Web page is developed, procedures will be completed.
Request for new portfolios (books) after close.
Drafting procedures.
Request for new employee security.
Request to change curve mapping in ERMS/CPS.
Drafting procedures.
Also, it appears the IT service agreement may have to be amended to cover the  Web pages used to push operational data to customers (If AEP wants to continue the service) and the Tariff filing system we just put into production.
Also, we will need to resolve how we handle counterparties that Enron credit has request we suspend trading when AEP wants to continue trading.
We have had discussions with AEP about all of these issues and procedures.
"
0,"As part of the HPL transition, we are reviewing imbalances on shipper contracts.
Attached below is the list and where we stand on reconcilations.
About 50% are reconciled, meaning that the counterparty agrees with our number.
Most we are waiting on information from the counterparty.
The big items are the imbalances with Duke Energy, Gulf Energy, and Tejas.
Rita and I have people working with these counterparties to get good information.
thanks
"
0,"Sally,  Trying to remember your email so I can give you new contact info...here it is.
Sorry I missed your call.
I was here 'til after 10--you'd think
"
1,"Sally, One of the things that Greg Piper has asked me to do is to take a look at the rest of the year and get each of the VP's to assess their margins and EBIT for the remainder of 2001.
For Energy Operations, that is usually very easy since there has been no revenues, and all of the costs are allocated out, so there should be zero EBIT if nothing changed.
Given your present direction, however, you may be generating some margin in 2001.
Do you have a feel for an amount I can put into our analysis and will 100% of your costs continue to be billed out or will some be applied to this new activity?
I am hoping to put something together next week, so if you or a designate could let me know in a few days I would appreciate it.
Kerry Roper (x5-4895)
"
0,"Sally,  Here's the first draft of a presentation geared toward prospective customers for our mid and back office services.
The message is more of a fact-finding than sales message.
Would appreciate your feedback.
(Jeff Harbert has not given me his take on it as of yet.)
Thanks,
"
0,"In order to maximize the potential synergies between the various mid- and back- office functions, to decrease replication errors, and to increase communication standards; are there any plans of creating a platform or reference center to bridge the differences between the systems, processes, and terminology of the various departments.
Perhaps a common resource center offering access to on-line system manuals and business unit overviews (which currently exist only in paper form or in some cases within the actual system database).
The reason: With Enron's size and transaction volume, many of the functions and the data managed by various groups within Enron (i.e.
credit, risk, settlements, volume management, global contracts, global counterparties, global rates, and the commercial systems) are fragmented.
Having participated in various process reviews and trouble-shooting/clean-up projects there seems to be a large disconnect between groups operating in various systems.
These disconnects; rather they be lack of information or understanding of how data flows between systems, how the data managed within each system impacts other upstream or downstream systems, or how the business processes within one group/system impacts the overall functionality of other groups, create large cracks producing an opportunity for mismanaged data, incomplete business reports, and increased risk to Enron.
The ideal objective; increase communication standards through a better understanding of system data functions/requirements and business processes, decrease system downtime and replication errors through a better understanding of the data relationships between systems, maximize department-to-department synergies (left hand knows what the right hand is doing), eliminate repetition, and further reduce potential risks to Enron due to information/business process oversight.
"
0,"Please review and abide by the following travel policy and best practices.
Feel free to call either Tina Spiller or Peggy McCurley if you have any travel policy questions.
Thank you.
"
0,"Sally,  You had mentioned in a voice mail that you have a spreadsheet that helps track the assets that NewCo is looking at.
I would like to work off the same sheet for consistency.
Also, when you get the chance I'd like to sit down and discuss Dave's plan of moving all the 'risk mgmt' team on the 31st  floor of ECN.
Regards,
"
0,"Hi all,  Please find attached the main model assumptions as discussed yesterday.
I have not included the IT Hardware and Software assumptions since we need to come up with a new set of numbers based on real expenditures.
I am also attaching a table that Fred forwarded me with a more accurate counterparty count (including the breakdown by type).
This includes the total companies for the North American Market and we need to determine the targeting criteria within each group.
This number should allows us to obtain a better estimate of the total market size.
It'll be great if you can take a look and let me know what makes sense, what doesn't, what do you think is missing, etc.
I can be reached at extension 54658.
Thanks!
"
0,"Sally,  Thanks for taking the time to discuss origination opportunities in EWS.
Per our discussion, I have attached a few presentations we have used during executive briefings with customers.
I have also attached a copy of my resume'.
Regards,
"
0,"Hi Sally -   Just wanted to let you know that I have recently begun collaborating with an ebusiness consultant from CGI - a large Canadian systems integrator with an energy practice - on a demand-generation piece that should be published in the trades in a few months.
The slant is on the scaling systems - IT and people - and the reduction in costs brought about by mid and back office systems affected by a sharp increase in online trading in the energy sector.
Eventually, will probably be looking for some quotes and input from you or your ops people.
I'll keep you up to date.
Thanks,
"
0,"Sally,  Attached is the updated of the headcount file I sent you on Friday.
I misunderstood the original request and provided December 31 plan for all four years.
I have now updated the file with December 31 actual headcount numbers for 1998 through 2000 and plan for 2001.
I have also updated the EGM numbers and inserted a summary tab.
If you have any questions, let me know.
Thanks,
"
0,"ttached are the revenues and the volumes per counterparty that you requested.
Please note that the revenue and OPM cost information is in Canadian dollars.
I will be forwarding a copy of our MSA Agreement template shortly.
Please call me once you've had a chance to review the information.
"
0,"Due to the announcement Friday of the new organization of the trading groups to EWS, and the decision to include the risk control groups as part of Enron NetWorks, please hold off on making any of the below noted moves until we have resorted everything out.
We will endeavor to have this clarified by mid-week to enable us to make everything effective as of April 30.
Thanks
"
1,"Kerry,  As you are probably aware, the EES Risk Control organization is moving under Sally as of April 30, 2001.
Our initial thought was we would keep all the former EES employees together in a new ENA accounting entity, but have now decided that the Risk Control group needs to be captured as part of Enron NetWorks.
These were previously set up under a new ENA company number (#1596).
I don't know if within SAP we can simply repoint the profit and cost centers set up below to roll-up under ENW now instead of ENA, if not, we will need five new ones set up as follows:  	Executive (Meredith Eggleston)-27101 [Simper, Keith]  ,150260 	Risk Analytics (Neil Hong)-27102 [Simper, Keith]  ,150261  	Strategic Operations, Process & Systems (Scott Mills)-27103 [Simper, Keith]  150262  	Deal Capture/Confirmation (Meredith Eggleston)-27104 [Simper, Keith]  ,150263  	Global Data Management (Mark Evans)27105 [Simper, Keith]  ,150264   Thanks and don't hesitate to call with questions.
Thanks
"
0,"Sally,  I am also working with the Commodity Logic people, and we thought it will be great if we can sit down with the CL Module Managers and some of your people (maybe James Scribner, Beth Apollo and Leslie Reeves) to talk about the pricing assumptions and estimates for Commodity Logic.
I think your group can add a lot value here by validating prices (would you be willing to pay x dollars for the product?, etc.).
Do you think a meeting is a good idea?
If not, can you think of a better way to capture this valuable input?
Thanks for your help!
"
0,"All,  Here's a presentation outline that can be used to spark conversation at an initial customer meeting.
Please forward any comments back and I'll incorporate them.
Thanks,
"
0,"These guys are new - system is ready for beta testing.
Offering an ASP solution for mid and back offices, including lots of reporting and credit.
May 3, 2001---A new middle and back office Application Service Provider (ASP) solution has been launched by Derigen Consulting.
The Derigen Trade Center is designed to provide small and mid-sized trading and marketing operations an entry point into a comprehensive trading system.
(5/4/2001)
"
1,"Folks have been asking just who is participating in the 2002 Business-Civic Leadership Forum that starts tonight.
Here is the roster.
Marilou A. Schopper Senior Vice President Center for Houston's Future
"
0,"I wanted to take a minute to commend all of you on a job well done in successfully integrating WebModal and implementing the operational processes for Freight Markets in a very short period of time.
I have been involved in several acquisitions over the years here at Enron and I have never seen one that went as well as WebModal from an operational standpoint.
Everyone came together as a team and ensured that integration timelines were met and that the business was allowed to continue its daily operations with minimal problems internally or to our external counterparties.
Again, congratulations on a great job.
Thanks for all of your hard work.
Brent
"
0,"The following is an update of the last two meetings of the FASB and decisions made regarding goodwill and intangible assets:  The Board reiterated that they intend to release the statement in final form in June 2001 despite publicity to the contrary.
The Board decided that goodwill should be tested for impairment annually rather than on an events-and-circumstances basis as previously proposed.
Additionally, goodwill should be tested for impairment during interim periods if an event or circumstance occurs between annual tests that might reduce the fair value of a reporting unit below its book value.
It should also be tested for impairment on an interim basis when (1) a more-likely-than-not expectation exists that a reporting unit or a significant portion of a reporting unit will be sold or disposed of, or (2) a significant asset group within a reporting unit is tested for recoverability under SFAS 121.
The Board changed the proposed method for determining the amount of goodwill to be included in the net assets to be disposed of.
Under the new method, a portion of the reporting unit's goodwill will be allocated to all divestitures.
I do not believe that the Board gave full consideration to all of the issues surrounding this decision.
In particular, they did not address application to divestitures that result in a loss prior to or as a result of goodwill allocation and disposals of equity, cost or fair value method investments.
additionally, the calculation itself is arbitrary and onerous in that fair values of the reporting unit and its recognized and unrecognized assets and liabilities will have to be determined each time a divestiture is done.
I will be consulting with AA on this to see if they can encourage the Board to give thought to these issues prior to releasing the final statement since they do not intend to discuss the issue further at this time.
The Board changed the proposed method of allocating goodwill upon an acquisition to allow for allocation of goodwill in an acquisition to a reporting unit even if none of the assets or liabilities of the acquired company have been allocated to that reporting unit.
Please feel free to call me if you have any questions on the latest developments.
Thanks.
Mary
"
0,"Meredith,  We have done some more work on this PRC attendee list.
Sally added:  Mark & Colette to Global pre-meeting You, Neil & Scott to Risk Mgmt pre-meeting You & Mark to final meeting.
Please let me know Monday, if possible, if this is okay, or if any other changes need to be made.
Thanks for your help!
!
"
0,"The Board decided in today's meeting to delay the effective date for adoption of the goodwill and intangible asset portion of the business combinations exposure draft to fiscal years beginning after December 15, 2001, permitting early adoption for fiscal years beginning after March 31, 2001 if financial statements for the first quarter have not yet been reported.
This means that goodwill amortization will continue through year-end.
Discussion is continuing on when the first impairment analysis will be required given the new adoption date and whether or not initial impairments may be reported as a change in accounting principle.
Adoption of the business combinations portion of the exposure draft is still anticipated to be required for acquisitions subsequent to June 30, 2001.
The main implication of this is that more excess purchase price is expected to be allocated to identifiable intangible assets rather than goodwill for acquisitions completed after this date.
The pooling-of-interests method of accounting for business combinations is still anticipated to be eliminated as of June 30, 2001.
"
0,"There seems to be some confusion around which DPR captures credit reserve and consumption premium reserves and which balance sheet these items fall on.
My understanding in talking with both Don and Kevin is that since EES is, on a go-forward basis, being granted origination (which would be the residual after all reserves are applied) that all prudency/reserve items will rest on the WhEES DPR.
The EES DPR will be just a single line net origination number.
We do need to capture the activity related to DSM in the EES DPR (including some portion of credit reserve and drift) but until we have the system capability to capture this it may just have to be part of the whole WhEES bucket.
This tracks with the idea that all future exposures (be they be wholesale price movement, tariff movement, credit exposure, etc.)
be borne by EWS.
If so, they need the reserves to properly offset any realized activity.
The balance sheet reserves associated with these items already rest in the ledgers that are rolling up underneath EWS now.
Reflecting the positions on the WhEES DPR will make them consistent with how we are capturing them from an accounting perspective.
If anyone disagrees with this treatment, please respond to all the parties above so we can resolve this issue.
If there are no objections I would recommend moving the credit reserve over at the next possible point.
Wade  P.S.
This thinking only reflects how things are currently contemplated, if the mix around what is with EWS vs. EES (i.e., accounts receivable) we may want to rethink the credit reserve portion.
"
